asset_type,source,status,notes,recommended_use
Facebook cover/profile photos,https://www.facebook.com/animalcarecenterpetspots/,blocked by Facebook timeout/throttling,Export manually from Page Photos/Cover/Profile,Logo reference and social profile identity
Facebook North Coast reopening post,Facebook result id 1277241224188303,not downloaded,Snippet says Pet Spot returned to North Coast / summer opening,Campaign copy and seasonal post reference
Facebook mobile clinic Sahel post,Facebook result id 792954932616937,not downloaded,Snippet says mobile clinic at Sahel next to Wahat Khattab in front of Amwaj,Service/route/location post
Facebook location post,Facebook result id 2233048133416256,not downloaded,Snippet mentions Km 128 Sidi Abdel Rahman near Agora Mall/Marassi/IKEA,Location clarification needed
Google Maps store photos,https://share.google/uSM5VJCFUzO2WFCpG,blocked unsafe redirect/direct fetch failed,Open the Google Maps link manually and download owner photos/screenshots,Storefront proof and trust content
Instagram profile visuals,https://www.instagram.com/pet_spot_clinic/,blocked by Instagram,Export manually or provide screenshots,Modern visual references
Yellow Pages listing,https://yellowpages.com.eg/en/profile/pet-spot/671305,data accessible/no photos extracted,Address/category/branch data,Directory credibility reference
